[
  {
    "scenario": "01-roc-only-no-profits",
    "tags": ["baseline", "roc"],
    "notes": "Exit proceeds exactly equal deal cost - only ROC tier allocates, LP gets 100%",
    "input": {
      "policy": {
        "id": "truth-001",
        "name": "Standard American Waterfall",
        "type": "american",
        "preferredReturnRate": "0.08",
        "hurdleRateBasis": "contributed",
        "cumulativeCalculations": true,
        "tiers": [
          {
            "tierType": "return_of_capital",
            "priority": 1
          },
          {
            "tierType": "preferred_return",
            "priority": 2,
            "rate": "0.08"
          },
          {
            "tierType": "gp_catch_up",
            "priority": 3,
            "catchUpRate": "1.0"
          },
          {
            "tierType": "carry",
            "priority": 4,
            "rate": "0.20"
          }
        ]
      },
      "exitProceeds": "1000000.00",
      "dealCost": "1000000.00"
    },
    "expected": {
      "lpDistribution": "1000000.00",
      "gpDistribution": "0.00",
      "totalDistributed": "1000000.00",
      "breakdown": [
        {
          "tier": "return_of_capital",
          "lpAmount": "1000000.00",
          "gpAmount": "0.00"
        }
      ]
    }
  },
  {
    "scenario": "02-small-profits-below-hurdle",
    "tags": ["baseline", "partial-hurdle"],
    "notes": "Profits exist but don't fully satisfy 8% preferred return - LP gets all",
    "input": {
      "policy": {
        "id": "truth-002",
        "name": "Standard American Waterfall",
        "type": "american",
        "preferredReturnRate": "0.08",
        "hurdleRateBasis": "contributed",
        "cumulativeCalculations": true,
        "tiers": [
          {
            "tierType": "return_of_capital",
            "priority": 1
          },
          {
            "tierType": "preferred_return",
            "priority": 2,
            "rate": "0.08"
          },
          {
            "tierType": "gp_catch_up",
            "priority": 3,
            "catchUpRate": "1.0"
          },
          {
            "tierType": "carry",
            "priority": 4,
            "rate": "0.20"
          }
        ]
      },
      "exitProceeds": "1030000.00",
      "dealCost": "1000000.00"
    },
    "expected": {
      "lpDistribution": "1030000.00",
      "gpDistribution": "0.00",
      "totalDistributed": "1030000.00",
      "breakdown": [
        {
          "tier": "return_of_capital",
          "lpAmount": "1000000.00",
          "gpAmount": "0.00"
        },
        {
          "tier": "preferred_return",
          "lpAmount": "30000.00",
          "gpAmount": "0.00"
        }
      ]
    }
  },
  {
    "scenario": "03-profits-meet-hurdle-exactly",
    "tags": ["baseline", "hurdle-exact", "rounding"],
    "notes": "Profits exactly satisfy 8% preferred return - boundary case, no catch-up",
    "input": {
      "policy": {
        "id": "truth-003",
        "name": "Standard American Waterfall",
        "type": "american",
        "preferredReturnRate": "0.08",
        "hurdleRateBasis": "contributed",
        "cumulativeCalculations": true,
        "tiers": [
          {
            "tierType": "return_of_capital",
            "priority": 1
          },
          {
            "tierType": "preferred_return",
            "priority": 2,
            "rate": "0.08"
          },
          {
            "tierType": "gp_catch_up",
            "priority": 3,
            "catchUpRate": "1.0"
          },
          {
            "tierType": "carry",
            "priority": 4,
            "rate": "0.20"
          }
        ]
      },
      "exitProceeds": "1080000.00",
      "dealCost": "1000000.00"
    },
    "expected": {
      "lpDistribution": "1080000.00",
      "gpDistribution": "0.00",
      "totalDistributed": "1080000.00",
      "breakdown": [
        {
          "tier": "return_of_capital",
          "lpAmount": "1000000.00",
          "gpAmount": "0.00"
        },
        {
          "tier": "preferred_return",
          "lpAmount": "80000.00",
          "gpAmount": "0.00"
        }
      ]
    }
  },
  {
    "scenario": "04-profits-exceed-hurdle-with-catchup",
    "tags": ["baseline", "catch-up", "full-waterfall"],
    "notes": "Profits exceed hurdle, GP catch-up activates to reach 20% carry target",
    "input": {
      "policy": {
        "id": "truth-004",
        "name": "Standard American Waterfall",
        "type": "american",
        "preferredReturnRate": "0.08",
        "hurdleRateBasis": "contributed",
        "cumulativeCalculations": true,
        "tiers": [
          {
            "tierType": "return_of_capital",
            "priority": 1
          },
          {
            "tierType": "preferred_return",
            "priority": 2,
            "rate": "0.08"
          },
          {
            "tierType": "gp_catch_up",
            "priority": 3,
            "catchUpRate": "1.0"
          },
          {
            "tierType": "carry",
            "priority": 4,
            "rate": "0.20"
          }
        ]
      },
      "exitProceeds": "1500000.00",
      "dealCost": "1000000.00"
    },
    "expected": {
      "lpDistribution": "1080000.00",
      "gpDistribution": "420000.00",
      "totalDistributed": "1500000.00",
      "breakdown": [
        {
          "tier": "return_of_capital",
          "lpAmount": "1000000.00",
          "gpAmount": "0.00"
        },
        {
          "tier": "preferred_return",
          "lpAmount": "80000.00",
          "gpAmount": "0.00"
        },
        {
          "tier": "gp_catch_up",
          "lpAmount": "0.00",
          "gpAmount": "420000.00"
        }
      ]
    }
  },
  {
    "scenario": "05-no-hurdle-classic-carry-split",
    "tags": ["baseline", "no-hurdle", "simple-carry"],
    "notes": "Zero preferred return - simple 80/20 split after ROC",
    "input": {
      "policy": {
        "id": "truth-005",
        "name": "No Hurdle Waterfall",
        "type": "american",
        "preferredReturnRate": "0",
        "hurdleRateBasis": "contributed",
        "cumulativeCalculations": true,
        "tiers": [
          {
            "tierType": "return_of_capital",
            "priority": 1
          },
          {
            "tierType": "carry",
            "priority": 2,
            "rate": "0.20"
          }
        ]
      },
      "exitProceeds": "1500000.00",
      "dealCost": "1000000.00"
    },
    "expected": {
      "lpDistribution": "1400000.00",
      "gpDistribution": "100000.00",
      "totalDistributed": "1500000.00",
      "breakdown": [
        {
          "tier": "return_of_capital",
          "lpAmount": "1000000.00",
          "gpAmount": "0.00"
        },
        {
          "tier": "carry",
          "lpAmount": "400000.00",
          "gpAmount": "100000.00"
        }
      ]
    }
  },
  {
    "scenario": "06-rounding-tie-positive-0.005",
    "tags": ["rounding", "excel-parity", "edge-case"],
    "notes": "Exit proceeds with 0.005 tie - tests Excel ROUND away from zero (positive)",
    "input": {
      "policy": {
        "id": "truth-006",
        "name": "Rounding Test Waterfall",
        "type": "american",
        "preferredReturnRate": "0",
        "hurdleRateBasis": "contributed",
        "cumulativeCalculations": true,
        "tiers": [
          {
            "tierType": "return_of_capital",
            "priority": 1
          },
          {
            "tierType": "carry",
            "priority": 2,
            "rate": "0.20"
          }
        ]
      },
      "exitProceeds": "100.005",
      "dealCost": "0"
    },
    "expected": {
      "lpDistribution": "80.00",
      "gpDistribution": "20.00",
      "totalDistributed": "100.01",
      "breakdown": [
        {
          "tier": "return_of_capital",
          "lpAmount": "0.00",
          "gpAmount": "0.00"
        },
        {
          "tier": "carry",
          "lpAmount": "80.00",
          "gpAmount": "20.00"
        }
      ]
    }
  },
  {
    "scenario": "07-rounding-tie-negative-0.005",
    "tags": ["rounding", "excel-parity", "edge-case", "loss"],
    "notes": "Negative exit with -0.005 tie - tests Excel ROUND away from zero (negative)",
    "input": {
      "policy": {
        "id": "truth-007",
        "name": "Rounding Test Waterfall",
        "type": "american",
        "preferredReturnRate": "0",
        "hurdleRateBasis": "contributed",
        "cumulativeCalculations": true,
        "tiers": [
          {
            "tierType": "return_of_capital",
            "priority": 1
          },
          {
            "tierType": "carry",
            "priority": 2,
            "rate": "0.20"
          }
        ]
      },
      "exitProceeds": "-100.005",
      "dealCost": "0"
    },
    "expected": {
      "lpDistribution": "0.00",
      "gpDistribution": "0.00",
      "totalDistributed": "0.00",
      "breakdown": []
    }
  },
  {
    "scenario": "08-full-catchup-100-percent",
    "tags": ["catch-up", "full-catchup"],
    "notes": "100% catch-up rate - GP gets all residual until target carry achieved",
    "input": {
      "policy": {
        "id": "truth-008",
        "name": "Full Catch-Up Waterfall",
        "type": "american",
        "preferredReturnRate": "0.08",
        "hurdleRateBasis": "contributed",
        "cumulativeCalculations": true,
        "tiers": [
          {
            "tierType": "return_of_capital",
            "priority": 1
          },
          {
            "tierType": "preferred_return",
            "priority": 2,
            "rate": "0.08"
          },
          {
            "tierType": "gp_catch_up",
            "priority": 3,
            "catchUpRate": "1.0"
          },
          {
            "tierType": "carry",
            "priority": 4,
            "rate": "0.20"
          }
        ]
      },
      "exitProceeds": "1200000.00",
      "dealCost": "1000000.00"
    },
    "expected": {
      "lpDistribution": "1080000.00",